{
  "schema_version": 1,
  "profile": {
    "id": "x86-8c-amx-multiclient-ttfa",
    "description": "Balanced low-TTFA profile for concurrent streaming requests on an 8-core Intel AMX host with SMT disabled.",
    "objective": {
      "primary": "ttfa",
      "secondary": "throughput",
      "concurrency_range": [2, 8],
      "preferred_concurrency": 2,
      "quality_changes_allowed": false
    }
  },
  "hardware": {
    "architecture": "x86_64",
    "cpu_family": "Intel Xeon Platinum 8581C",
    "logical_cpus": 16,
    "physical_cores": 8,
    "threads_per_core": 2,
    "numa_nodes": 1,
    "l3_mib": 260,
    "isa_features_used": [
      "avx512f",
      "avx512bw",
      "avx512vl",
      "avx512dq",
      "avx512vnni",
      "avx512bf16",
      "amx_tile",
      "amx_int8",
      "amx_bf16"
    ],
    "notes": "Disable SMT before launch. The qualified workers use CPUs 0-3 and 4-7, one thread per physical core. The host has one NUMA node and a 260 MiB shared L3."
  },
  "build": {
    "target": "blas",
    "make": {
      "command": "make blas SIMD=amx -j8",
      "variables": {
        "SIMD": "amx"
      }
    },
    "requirements": {
      "blas": "OpenBLAS pthread build",
      "isa": "AVX-512 VNNI, AVX-512 BF16, AMX tile, AMX INT8 and AMX BF16"
    }
  },
  "server": {
    "prefork_workers": 2,
    "threads_per_worker": 4,
    "batch_size": 8,
    "max_queue": 1,
    "queue_timeout_ms": 0,
    "max_request_seconds": 60,
    "worker_affinity": "worker 0 -> CPUs 0-3; worker 1 -> CPUs 4-7, after SMT is disabled"
  },
  "streaming": {
    "first_chunk_ramp": [1, 2, 4],
    "decode_chunk": 8,
    "decode_chunk_busy": 0
  },
  "runtime": {
    "precision": {
      "talker_weights": "int8 per output row",
      "code_predictor_weights": "int8 per output row",
      "speech_decoder_weights": "fp32",
      "activations": "fp32 at the API boundary; int8 packing is internal to matmat",
      "gemm_backend": "AMX INT8/BF16 GEMM where the shape gate is met; shape-aware AVX-512 VNNI and AVX-512 BF16 fallbacks otherwise"
    },
    "environment": {
      "OPENBLAS_NUM_THREADS": {
        "value": null,
        "why": "Must be absent so the engine sizes OpenBLAS from each worker's phase thread budget.",
        "revert": "set it explicitly only for a measured override"
      },
      "OPENBLAS_THREAD_TIMEOUT": {
        "value": "1",
        "why": "Prevents idle OpenBLAS workers from spinning against the engine pool.",
        "revert": "unset"
      },
      "QWEN_AMX_MIN_B": {
        "value": "2",
        "why": "Enables AMX INT8 matmat from the first batched regime.",
        "revert": "use the compiled default"
      },
      "QWEN_PREFIX_CACHE": {
        "value": "1",
        "why": "Enables reuse of request-independent prefix work.",
        "revert": "QWEN_PREFIX_CACHE=0"
      },
      "QWEN_NO_VNNI_TILE": {
        "value": null,
        "why": "Must remain absent so the shape-aware AVX-512 VNNI fallback remains available.",
        "revert": "set QWEN_NO_VNNI_TILE=1 only for a control run"
      }
    }
  },
  "launch": {
    "executable": "./qwen_tts",
    "extra_arguments": [],
    "server_env_serialization": "comma"
  },
  "qualification": {
    "status": "qualified",
    "workload": "Three synchronized waves at client concurrency 2, 4, 6 and 8 on the mixed 21-text qualification bank; SMT was disabled and each worker was pinned to a physical-core slice.",
    "benchmark_family": "TRUE_SIMULTANEOUS_WAVE",
    "model": "qwen3-tts-1.7b base checkpoint",
    "notes": "Latest SMT-off measurements gave TTFA p50/p95: C=2 176/421 ms, C=4 549/684 ms, C=6 655/1093 ms, C=8 890/1327 ms. This topology was the balanced concurrent choice: it gave the best measured request throughput at C=4, C=6 and C=8 among the tested topologies, while C=2 is the strict low-TTFA operating point."
  }
}
