{
  "schema_version": 1,
  "profile": {
    "id": "x86-8c-amx-c4-latency-ttfa",
    "description": "Fixed-C=4 latency-first profile for an 8-core Intel AMX host with SMT disabled; use only when four simultaneous clients are the explicit target.",
    "objective": {
      "primary": "ttfa",
      "secondary": "throughput",
      "concurrency_range": [4, 4],
      "preferred_concurrency": 4,
      "quality_changes_allowed": false
    }
  },
  "hardware": {
    "architecture": "x86_64",
    "cpu_family": "Intel Xeon Platinum 8581C",
    "logical_cpus": 16,
    "physical_cores": 8,
    "threads_per_core": 2,
    "numa_nodes": 1,
    "l3_mib": 260,
    "isa_features_used": [
      "avx512f",
      "avx512bw",
      "avx512vl",
      "avx512dq",
      "avx512vnni",
      "avx512bf16",
      "amx_tile",
      "amx_int8",
      "amx_bf16"
    ],
    "notes": "Disable SMT before launch. Four workers use CPU pairs 0-1, 2-3, 4-5 and 6-7. This profile is latency-first and has lower measured throughput than the 2x4 profile."
  },
  "build": {
    "target": "blas",
    "make": {
      "command": "make blas SIMD=amx -j8",
      "variables": {
        "SIMD": "amx"
      }
    },
    "requirements": {
      "blas": "OpenBLAS pthread build",
      "isa": "AVX-512 VNNI, AVX-512 BF16, AMX tile, AMX INT8 and AMX BF16"
    }
  },
  "server": {
    "prefork_workers": 4,
    "threads_per_worker": 2,
    "batch_size": 4,
    "max_queue": 1,
    "queue_timeout_ms": 0,
    "max_request_seconds": 60,
    "worker_affinity": "worker 0 -> CPU 0-1; worker 1 -> 2-3; worker 2 -> 4-5; worker 3 -> 6-7, after SMT is disabled"
  },
  "streaming": {
    "first_chunk_ramp": [1, 2, 4],
    "decode_chunk": 8,
    "decode_chunk_busy": 0
  },
  "runtime": {
    "precision": {
      "talker_weights": "int8 per output row",
      "code_predictor_weights": "int8 per output row",
      "speech_decoder_weights": "fp32",
      "activations": "fp32 at the API boundary; int8 packing is internal to matmat",
      "gemm_backend": "AMX INT8/BF16 GEMM where the shape gate is met; shape-aware AVX-512 VNNI and AVX-512 BF16 fallbacks otherwise"
    },
    "environment": {
      "OPENBLAS_NUM_THREADS": {
        "value": null,
        "why": "Must be absent so the engine sizes OpenBLAS from each worker's phase thread budget.",
        "revert": "set it explicitly only for a measured override"
      },
      "OPENBLAS_THREAD_TIMEOUT": {
        "value": "1",
        "why": "Prevents idle OpenBLAS workers from spinning against the engine pool.",
        "revert": "unset"
      },
      "QWEN_AMX_MIN_B": {
        "value": "2",
        "why": "Enables AMX INT8 matmat from the first batched regime.",
        "revert": "use the compiled default"
      },
      "QWEN_PREFIX_CACHE": {
        "value": "1",
        "why": "Enables reuse of request-independent prefix work.",
        "revert": "QWEN_PREFIX_CACHE=0"
      },
      "QWEN_NO_VNNI_TILE": {
        "value": null,
        "why": "Must remain absent so the shape-aware AVX-512 VNNI fallback remains available.",
        "revert": "set QWEN_NO_VNNI_TILE=1 only for a control run"
      }
    }
  },
  "launch": {
    "executable": "./qwen_tts",
    "extra_arguments": [],
    "server_env_serialization": "comma"
  },
  "qualification": {
    "status": "qualified",
    "workload": "Three synchronized waves at client concurrency 4 on the mixed 21-text qualification bank; SMT was disabled and all four worker pairs were pinned to physical-core slices.",
    "benchmark_family": "TRUE_SIMULTANEOUS_WAVE",
    "model": "qwen3-tts-1.7b base checkpoint",
    "speaker": "ryan",
    "notes": "Measured TTFA was approximately 372 ms p50 / 735 ms p95 with RTF 1.67. It reduced C=4 median TTFA versus 1x8 and 2x4, but measured request throughput was lower; choose it only for a fixed C=4 latency objective."
  }
}
